"2","Ervin Howell","suscipit repellat esse quibusdam voluptatem incidunt","False"
"2","Ervin Howell","distinctio vitae autem nihil ut molestias quo","True"
"2","Ervin Howell","et itaque necessitatibus maxime molestiae qui quas velit","False"
"2","Ervin Howell","adipisci non ad dicta qui amet quaerat doloribus ea","False"
"2","Ervin Howell","voluptas quo tenetur perspiciatis explicabo natus","True"
"2","Ervin Howell","aliquam aut quasi","True"
"2","Ervin Howell","veritatis pariatur delectus","True"
"2","Ervin Howell","nesciunt totam sit blanditiis sit","False"
"2","Ervin Howell","laborum aut in quam","False"
"2","Ervin Howell","nemo perspiciatis repellat ut dolor libero commodi blanditiis omnis","True"
"2","Ervin Howell","repudiandae totam in est sint facere fuga","False"
"2","Ervin Howell","earum doloribus ea doloremque quis","False"
"2","Ervin Howell","sint sit aut vero","False"
"2","Ervin Howell","porro aut necessitatibus eaque distinctio","False"
"2","Ervin Howell","repellendus veritatis molestias dicta incidunt","True"
"2","Ervin Howell","excepturi deleniti adipisci voluptatem et neque optio illum ad","True"
"2","Ervin Howell","sunt cum tempora","False"
"2","Ervin Howell","totam quia non","False"
"2","Ervin Howell","doloremque quibusdam asperiores libero corrupti illum qui omnis","False"
"2","Ervin Howell","totam atque quo nesciunt","True"
